{
  "id": "GS-KAH-005",
  "source": "real",
  "language": "de",
  "theme": "familie",
  "messages": [
    {
      "role": "Therapist",
      "text": "Mhm.",
      "start_time": 933.662
    },
    {
      "role": "Client",
      "text": "Und hab dann auch noch mal das alles abgetippt und dann hab ich's auch vorgelesen. Freunde von mir wollten es hören. Dann hab ich das so als Sprachnachricht, hab ich das so zusammengefasst und dann hab ich gemerkt, whoa, da kommt jetzt aber viel, was ja erfolgreich von mir eigentlich verdrängt war.",
      "start_time": 934.322
    },
    {
      "role": "Therapist",
      "text": "Mhm.",
      "start_time": 951.762
    },
    {
      "role": "Client",
      "text": "Ja, und das kommt jetzt alles auf einmal hoch. [lacht leise] Und auch positive Momente, wo ich so denk: „Ah, guck mal, ich war neugierig, ich war verspielt, ich, äh, war so in meiner Welt.\"",
      "start_time": 952.762
    },
    {
      "role": "Therapist",
      "text": "Mhm.",
      "start_time": 967.862
    },
    {
      "role": "Client",
      "text": "Und gleichzeitig halt auch so diese heftige Abhängigkeit. Und dass meine Eltern das ja auch so 'n bisschen ausgenutzt haben, dass ich da gebunden war.",
      "start_time": 968.842
    },
    {
      "role": "Therapist",
      "text": "Was meinen Sie mit heftiger Abhängigkeit?",
      "start_time": 979.832
    },
    {
      "role": "Client",
      "text": "Das ist son Dorf mit tausendsechshundert Einwohnern gewesen und es gab nur einen Bus, der in die Stadt gefahren ist, der ist auch nur einmal am Tag gefahren. Ja, und, äh, man war sich bewusst, ohne Führerschein kannst du hier nicht weg. Und wenn, wo willst du hin? Zur Tankstelle. Da gibt's auch nichts außer Red Bull. Und dann... Es gab nur einen Pizza Service, der sich die Mühe gemacht hat, in dieses Dorf zu fahren und man hatte ja auch nicht viel Auswahl, was Menschen angeht.",
      "start_time": 983.502
    },
    {
      "role": "Therapist",
      "text": "Mhm.",
      "start_time": 1017.022
    },
    {
      "role": "Client",
      "text": "Ja, man hatte so die Gleichaltrigen und egal, wie die drauf waren, mit denen musste man halt dann auskommen.",
      "start_time": 1017.342
    },
    {
      "role": "Therapist",
      "text": "Mhm.",
      "start_time": 1024.021
    },
    {
      "role": "Client",
      "text": "Ja, und meine Eltern hatten auch eine ganz komische Erziehungsmethode. Das war eher sone Erpressungsmethode. Die wussten recht früh, dass ich sehr willensstark bin und stur. Und dann gab es immer dieses Druckmittel: „Wir fahren dich nicht zu deinem Ziel, wenn du nicht gehorchst.\" Ja. Oder wenn du dich nicht entschuldigst, dann kriegst du kein Geld, dann kannst du keine Busfahrkarte kaufen. Das war immer so dieses Dableiben müssen.",
      "start_time": 1025.202
    },
    {
      "role": "Therapist",
      "text": "Und in diesem Traum ist Ihnen quasi diese Klammer ins Gesicht gesprungen an dieser Bushaltestelle, während Sie durch den Matsch gelaufen sind. Oder Sie sind durch den Matsch gelaufen, um dorthin zu kommen. Und dann hat sich diese Klammer verwandelt in eine Spinne.",
      "start_time": 1066.222
    },
    {
      "role": "Client",
      "text": "Ja. Also die war lebendig. Das war wie son...",
      "start_time": 1084.722
    },
    {
      "role": "Therapist",
      "text": "Die Klammer war lebendig.",
      "start_time": 1088.612
    },
    {
      "role": "Client",
      "text": "Die Schöne und das Biest, wo dann plötzlich diese Gegenstände ein Leben kriegen.",
      "start_time": 1089.662
    },
    {
      "role": "Therapist",
      "text": "Mhm.",
      "start_time": 1095.582
    },
    {
      "role": "Client",
      "text": "So war die. Und die hat sich dann bei mir so-Ich habe mir auch vorhin solche Klammern gekauft, witzigerweise. [lacht]",
      "start_time": 1096.462
    },
    {
      "role": "Therapist",
      "text": "Haben Sie dann dabei daran gedacht?",
      "start_time": 1111.626
    },
    {
      "role": "Client",
      "text": "Nee, aber ich habe die in klein, ne, suche ich schon länger, so braune und dann dachte ich: „Jetzt gibt's braune Klammern.\" Und dann habe ich mir gedacht: \"Ja, das ist ja genau die Form, die ich im Traum...\" Die ist also so. Und da ist ja immer so ein Draht dran.",
      "start_time": 1114.246
    },
    {
      "role": "Therapist",
      "text": "Mhm.",
      "start_time": 1134.186
    },
    {
      "role": "Client",
      "text": "Und dieser Draht, der war mir so in der Mitte vom Gesicht und der hat mich gepiekst. Also ich habe gemerkt, die Klammer, die will auch mich so stechen, oder, ähm, ich dachte dann wirklich an so eine Spinne, die, die so beißt kurz.",
      "start_time": 1134.966
    },
    {
      "role": "Therapist",
      "text": "Mhm.",
      "start_time": 1151.946
    },
    {
      "role": "Client",
      "text": "Vielleicht giftig und dann lässt sie sich wieder so fallen, weil die lassen sich ja dann wieder so, so wegfallen.",
      "start_time": 1152.646
    },
    {
      "role": "Therapist",
      "text": "Also die hat sich dann auch fallen lassen?",
      "start_time": 1159.846
    },
    {
      "role": "Client",
      "text": "Die hat sich wieder fallen lassen, ja. [lacht] Das klingt so total verrückt, ja. Aber anscheinend hat es, hat es was damit zu tun, was mich beschäftigt. Ja.",
      "start_time": 1162.006
    },
    {
      "role": "Therapist",
      "text": "Ja, also, ähm, total symbolisch natürlich, ne? Also, der Träume sind ja immer auch überzeichnet, also extrem, ne? Ähm, wenn oft sehr drastische Bilder, aber zeigen ja doch oft, was eben in einem vorgeht und was einen beschäftigt. Und diese Klammer, genau, also die hat ja auch was Haltenes. Sie haben sich das jetzt auch gekauft. Also da ist ja auch was, was, was Angenehmes mit dabei, irgendwo, ne, was, was, ähm, das Gesicht auch... Ich weiß nicht, ob's-- Ich denk die ganze Zeit an zusammenhalten, ja? Gesicht zusammenhalten. Weiß ich aber auch nicht, ob das so, so stimmig ist. Und, äh, die Spinne steht ja auch für, dann, 'ne Angst, die Sie wirklich mal hatten über viele Jahre, ne, wenn Sie sagen, Sie hatten eine Spinnenphobie. Und dann kam die wieder, hat sie auch gebissen, aber dann ist sie abgefallen.",
      "start_time": 1179.596
    }
  ],
  "metadata": {
    "generator": null,
    "template_id": null,
    "message_count": 27,
    "total_chars": 3916,
    "duration_minutes": 4.1,
    "annotation_version": "v1.0",
    "anonymization": {
      "status": "anonymized",
      "method": "name_replacement",
      "original_hash": "7ba965549ddb8d7aad0cd14b13296af1e71b6935838198eab995fafd3fbfc3f3"
    }
  },
  "annotations": {
    "semantic_frame": {
      "tone": "narrative-exploratory",
      "themes": [
        "familie",
        "bindung"
      ],
      "relational_dynamics": "curious-differentiating",
      "intent": "family_pattern_analysis",
      "emotional_tenor": 0.0,
      "context_validity": 0.75,
      "offline_context_risk": 0.4
    },
    "semiotic_signs": [
      {
        "id": "SIGN-KAH-005-1",
        "locus": "t=934-1180s",
        "signifier": "Familiengeschichte",
        "type": "symbol",
        "denotation": "Family narrative as identity frame",
        "connotations": [
          "intergenerational pattern",
          "attachment history"
        ],
        "codes": [
          "familie"
        ],
        "markers": [
          "ATO_SYMBOL_IMAGE",
          "SEM_TRAPPED_AND_ESCAPE",
          "CLU_BODY_TO_MEANING_LOOP"
        ]
      }
    ],
    "expected_markers": {
      "ATO": [
        "ATO_SYMBOL_IMAGE"
      ],
      "SEM": [
        "SEM_TRAPPED_AND_ESCAPE"
      ],
      "CLU": [
        "CLU_BODY_TO_MEANING_LOOP"
      ]
    },
    "vad_trajectory": [
      {
        "t": 0.0,
        "valence": 0.35,
        "arousal": 0.4,
        "trigger": "session_start",
        "trigger_sign_id": "SIGN-KAH-005-1"
      },
      {
        "t": 0.25,
        "valence": 0.4,
        "arousal": 0.35,
        "trigger": "stable_exploration",
        "trigger_sign_id": "SIGN-KAH-005-1"
      },
      {
        "t": 0.5,
        "valence": 0.45,
        "arousal": 0.35,
        "trigger": "steady_work",
        "trigger_sign_id": "SIGN-KAH-005-1"
      },
      {
        "t": 0.75,
        "valence": 0.45,
        "arousal": 0.3,
        "trigger": "consolidation",
        "trigger_sign_id": "SIGN-KAH-005-1"
      },
      {
        "t": 1.0,
        "valence": 0.4,
        "arousal": 0.3,
        "trigger": "closing",
        "trigger_sign_id": "SIGN-KAH-005-1"
      }
    ],
    "therapy_indices": {
      "trust": 80,
      "conflict": 21,
      "deescalation": 82,
      "synchronization": 78,
      "semiotic_coherence": 74
    },
    "review_status": "llm_generated",
    "rater_a": null,
    "rater_b": null,
    "inter_rater_agreement": 0.0
  }
}